{
  "schema": "edit_task_v1",
  "id": "skl-module-2",
  "corpus": "scikit-learn",
  "category": "module-extraction-layout",
  "manifest_ref": {
    "corpus_id": "scikit-learn",
    "source_commit": "0885712e436b07cd04d60e955101aaf6a8cbb709",
    "seed": 7,
    "forge_version": "2"
  },
  "prompt": "A subpackage is missing the explicit public-surface declaration its neighbours use; add one to match them.",
  "rubric": {
    "must_surface": [
      "declares the module's public surface with an explicit __all__ list",
      "the exemplar locations to imitate"
    ],
    "answer_shape": "a small patch that makes the off-pattern site follow the convention"
  },
  "behavior": {
    "command": [
      "{python}",
      "{edits_root}/patches/scikit-learn/skl-module-2.probe.py"
    ],
    "assertion": "the module exposes a curated __all__",
    "discrimination": {
      "red": "the module has no __all__ and leaks every top-level name",
      "green": "the module exposes a curated __all__"
    }
  },
  "convention": {
    "rule_id": "py-all-export-list",
    "statement": "A package module declares its public surface with an explicit __all__ list so re-exports and star-imports are deliberate.",
    "conforms_pattern": "^__all__ = "
  },
  "exemplars": [
    {
      "path": "sklearn/callback/__init__.py",
      "lines": [
        15,
        19
      ],
      "claim": "declares the module's public surface with an explicit __all__ list",
      "target_identifiers": [
        "AutoPropagatedCallback",
        "CallbackContext"
      ]
    },
    {
      "path": "sklearn/cluster/__init__.py",
      "lines": [
        36,
        40
      ],
      "claim": "declares the module's public surface with an explicit __all__ list",
      "target_identifiers": [
        "DBSCAN",
        "HDBSCAN"
      ]
    }
  ],
  "blast_radius": {
    "allow": [
      "sklearn/**/__init__.py"
    ],
    "max_files": 2
  },
  "adjudication": {
    "annotators": [
      "ann-hyde",
      "ann-quill"
    ],
    "resolved": true,
    "notes": "Two independent passes selected the same live exemplars; no disagreement to resolve."
  },
  "oracle_patch": {
    "path": "patches/scikit-learn/skl-module-2.json",
    "format": "edit_oracle_patch_v1"
  },
  "existing_suite": {
    "command": [
      "{python}",
      "-m",
      "compileall",
      "-q",
      "sklearn"
    ],
    "notes": "unbuilt Cython tree: byte-compile is the only whole-corpus check that runs (import sklearn can never succeed on the unbuilt git-archive export; scipy/sklearn are not importable on the host); measured wall-clock on the forged seed-7 tree: python3 -m compileall -q sklearn ~8.6s, well under DEFAULT_TIMEOUT=120"
  }
}
