{
  "schema": "edit_task_v1",
  "id": "skl-api-1",
  "corpus": "scikit-learn",
  "category": "api-shape-consistency",
  "manifest_ref": {
    "corpus_id": "scikit-learn",
    "source_commit": "0885712e436b07cd04d60e955101aaf6a8cbb709",
    "seed": 7,
    "forge_version": "1"
  },
  "prompt": "One estimator method breaks the chainable-return contract the rest of the estimators honour; make it return the instance.",
  "rubric": {
    "must_surface": [
      "returns self at the end of a fit-style method for call chaining",
      "the exemplar locations to imitate"
    ],
    "answer_shape": "a small patch that makes the off-pattern site follow the convention"
  },
  "behavior": {
    "command": [
      "{python}",
      "{edits_root}/patches/scikit-learn/skl-api-1.probe.py"
    ],
    "assertion": "the method returns the estimator instance",
    "discrimination": {
      "red": "the method returns None and chaining raises AttributeError",
      "green": "the method returns the estimator instance"
    }
  },
  "convention": {
    "rule_id": "py-fit-returns-self",
    "statement": "A fit-style estimator method ends by returning self so calls can be chained, consistent with the estimator API.",
    "conforms_pattern": "^        return self$"
  },
  "exemplars": [
    {
      "path": "sklearn/callback/_callback_support.py",
      "lines": [
        18,
        46
      ],
      "claim": "returns self at the end of a fit-style method for call chaining",
      "target_identifiers": [
        "set_callbacks",
        "Parameters"
      ]
    },
    {
      "path": "sklearn/callback/tests/_utils.py",
      "lines": [
        190,
        228
      ],
      "claim": "returns self at the end of a fit-style method for call chaining",
      "target_identifiers": [
        "sample_weight",
        "callback_ctx"
      ]
    }
  ],
  "blast_radius": {
    "allow": [
      "sklearn/**"
    ],
    "max_files": 3
  },
  "adjudication": {
    "annotators": [
      "ann-hyde",
      "ann-quill"
    ],
    "resolved": true,
    "notes": "Two independent passes selected the same live exemplars; no disagreement to resolve."
  },
  "oracle_patch": {
    "path": "patches/scikit-learn/skl-api-1.json",
    "format": "edit_oracle_patch_v1"
  },
  "existing_suite": {
    "command": [
      "{python}",
      "-m",
      "compileall",
      "-q",
      "sklearn"
    ],
    "notes": "unbuilt Cython tree: byte-compile is the only whole-corpus check that runs (import sklearn can never succeed on the unbuilt git-archive export; scipy/sklearn are not importable on the host); measured wall-clock on the forged seed-7 tree: python3 -m compileall -q sklearn ~8.6s, well under DEFAULT_TIMEOUT=120"
  }
}
